{
  "schema": "harness/1",
  "engine": {
    "name": "claude-cli",
    "version": "2.1.306",
    "model": "opus"
  },
  "limits": {
    "standard": {
      "turns": 10,
      "repair_turns": 1,
      "seconds": 600,
      "cost_ceiling_usd": 1.0
    },
    "deep": {
      "turns": 20,
      "repair_turns": 2,
      "seconds": 900,
      "cost_ceiling_usd": 1.5
    }
  },
  "texts": {
    "characters": 40000,
    "diff_characters": 60000
  },
  "advisory": [
    "coderabbit"
  ]
}
